{"associations":[{"confidence":"high","event":{"coverage":"unknown","event_type":"process_start","line":1,"pid_present":true,"ppid_present":true,"redacted_fields":["actor","command","container_id","event_id","exec_id","trace_id","workspace"],"sha256":"72cb7df9cb1768d9d6522734e6893a5935a5369e8c5b9a34d5302841a4c1b1da","source_assurance":"imported_unverified","source_kind":"tetragon","stable_process_identity_present":true},"match_status":"matched","proof_status":"corroborating_unverified","reason_codes":["actor_exact","command_name_exact","receipt_id_hint_exact","side_effect_compatible","time_window","trace_id_exact"],"receipt_id":"receipt:dac626a959647410abf87d2f20eaf458"}],"event_source":{"assurance":"imported_unverified","coverage":"unknown","format":"tetragon","sha256":"cda80eadb6e0275d219b985e78e262550da9eb9fc138be5474df9d19d255920e"},"limitations":["imported sensor JSON is not authenticated by this report","correlation confidence measures association strength, not sensor truth or independent proof","weak and ambiguous associations are non-proof","missing events do not prove absence without separately attested sensor coverage","Falco JSON is normally alert-scoped; missing alerts do not imply complete runtime coverage","the report is detached and does not mutate the signed receipt chain"],"receipt_summaries":[{"ambiguous_event_count":0,"event_types":["process_start"],"evidence_status":"corroborated","matched_event_count":1,"receipt_id":"receipt:dac626a959647410abf87d2f20eaf458","receipt_index":0},{"ambiguous_event_count":0,"event_types":[],"evidence_status":"unobserved","matched_event_count":0,"receipt_id":"receipt:5b684ed4af8f1d439db9e44fb90ca83f","receipt_index":1},{"ambiguous_event_count":0,"event_types":[],"evidence_status":"unobserved","matched_event_count":0,"receipt_id":"receipt:729582baa33fe86fdae5c29a0459d932","receipt_index":2}],"receipt_verification":{"receipt_count":3,"result":"verified_chain_only","source_sha256":"c5ddc92998406db76dacb94135140a630cf1e3bd55bccb3579e5724ea820ca38","verified":true},"schema_version":"ardur.runtime_evidence_correlation_report.v0.1","sensitive_output_redacted":true,"summary":{"ambiguous_event_count":0,"ambiguous_receipt_count":0,"corroborated_receipt_count":1,"event_count":1,"matched_event_count":1,"receipt_count":3,"unmatched_event_count":0,"unobserved_receipt_count":2,"weak_event_count":0}}
