{"associations":[{"confidence":"high","event":{"coverage":"alert_only","event_type":"network_connect","line":1,"pid_present":true,"ppid_present":true,"redacted_fields":["actor","command","destination","event_id","trace_id"],"sha256":"e82768a27de5bf3199ccf52e888aa9d28a13ff1d084ce2fbab8ba5c3b49f831d","source_assurance":"imported_unverified","source_kind":"falco","stable_process_identity_present":true},"match_status":"matched","proof_status":"corroborating_unverified","reason_codes":["actor_exact","receipt_id_hint_exact","side_effect_compatible","target_exact","time_window","trace_id_exact"],"receipt_id":"receipt:729582baa33fe86fdae5c29a0459d932"}],"event_source":{"assurance":"imported_unverified","coverage":"alert_only","format":"falco","sha256":"1c686196b99ebbe6f68a8995124f3acd28e6bb8f4a06e6f59b0148b7681bfe1d"},"limitations":["imported sensor JSON is not authenticated by this report","correlation confidence measures association strength, not sensor truth or independent proof","weak and ambiguous associations are non-proof","missing events do not prove absence without separately attested sensor coverage","Falco JSON is normally alert-scoped; missing alerts do not imply complete runtime coverage","the report is detached and does not mutate the signed receipt chain"],"receipt_summaries":[{"ambiguous_event_count":0,"event_types":[],"evidence_status":"unobserved","matched_event_count":0,"receipt_id":"receipt:dac626a959647410abf87d2f20eaf458","receipt_index":0},{"ambiguous_event_count":0,"event_types":[],"evidence_status":"unobserved","matched_event_count":0,"receipt_id":"receipt:5b684ed4af8f1d439db9e44fb90ca83f","receipt_index":1},{"ambiguous_event_count":0,"event_types":["network_connect"],"evidence_status":"corroborated","matched_event_count":1,"receipt_id":"receipt:729582baa33fe86fdae5c29a0459d932","receipt_index":2}],"receipt_verification":{"receipt_count":3,"result":"verified_chain_only","source_sha256":"c5ddc92998406db76dacb94135140a630cf1e3bd55bccb3579e5724ea820ca38","verified":true},"schema_version":"ardur.runtime_evidence_correlation_report.v0.1","sensitive_output_redacted":true,"summary":{"ambiguous_event_count":0,"ambiguous_receipt_count":0,"corroborated_receipt_count":1,"event_count":1,"matched_event_count":1,"receipt_count":3,"unmatched_event_count":0,"unobserved_receipt_count":2,"weak_event_count":0}}
